{
  "schema_version": "1.0",
  "reference_id": "libref.0000000021ac",
  "title": "harness_local_ast_gemini_economy_burndown_patch_20260708.diff",
  "file_library_id": "file_0000000021ac720e91f1bc145895d9b7",
  "file_created_at": "2026-07-08T12:03:18Z",
  "file_modified_at": "2026-07-08T12:03:18Z",
  "native_language": "en",
  "availability": "LIBRARY_REFERENCE_ONLY",
  "materialized_bytes": false,
  "translation_status": "NOT_REQUIRED_NATIVE_ENGLISH",
  "priority": "P3",
  "suggested_kind": "patch",
  "suggested_status": "HISTORICAL",
  "suggested_contexts": [
    "Evidence / Provenance",
    "Validation / Assurance",
    "Harness / Agent OS Architecture"
  ],
  "lineage_family": "july-2026-burndown-patches",
  "lineage_order_hint": "2026-07-08T12:03:18Z",
  "reported_sha256": null,
  "reported_size_bytes": null,
  "hash_status": "UNKNOWN",
  "discovered_at": "2026-08-11T15:55:00Z",
  "discovery_basis": "ChatGPT File Library discovery; exact raw bytes are not mounted in the active filesystem.",
  "notes": ""
}
