{
  "schema_version": "1.0",
  "reference_id": "flref.infosurv.ed3ebc414557",
  "title": "tare_tools_information_survival_implementation_architecture_2026-08-12.html",
  "file_library_id": "file_00000000d4a0820ebb16a09a390229be",
  "file_created_at": "2026-08-12",
  "file_modified_at": "2026-08-12",
  "native_language": "pt-BR",
  "availability": "LIBRARY_REFERENCE_ONLY",
  "materialized_bytes": false,
  "translation_status": "BLOCKED_EXACT_SOURCE_NOT_MATERIALIZED",
  "priority": "P0",
  "suggested_kind": "implementation-research",
  "suggested_status": "PROPOSED",
  "suggested_contexts": [
    "Project / Workspace",
    "Workflow",
    "Context / Memory",
    "Reliability / Effects",
    "Validation / Assurance",
    "Evidence / Provenance",
    "Evolution Control",
    "Resources / Artifacts"
  ],
  "lineage_family": "information-survival-demand-lineage-2026-08-12",
  "lineage_order_hint": null,
  "reported_sha256": "eb1293b484c26555bd29df4d5e537b824eed5c8c206913f9d033c9799973ed1b",
  "reported_size_bytes": 42437,
  "hash_status": "REPORTED_NOT_LOCALLY_VERIFIED",
  "discovered_at": "2026-08-12",
  "discovery_basis": "Shared-chat ingestion via File Library; public share URL cache-missed in this runtime.",
  "notes": "Expected hash/size are reported by the research-pack validation manifest. Raw bytes are not mounted locally; no exact local source path is asserted."
}
