{
  "schema_version": "1.0",
  "reference_id": "libref.0000000085f8",
  "title": "tare_tools_interoperability_learning_evolution_scientific_research_2026-08-10.html",
  "file_library_id": "file_0000000085f8820ea17069240615c747",
  "file_created_at": "2026-08-10T12:44:54Z",
  "file_modified_at": "2026-08-10T12:44:54Z",
  "native_language": "pt-BR",
  "availability": "LIBRARY_REFERENCE_ONLY",
  "materialized_bytes": false,
  "translation_status": "BLOCKED_EXACT_SOURCE_NOT_MATERIALIZED",
  "priority": "P0",
  "suggested_kind": "research",
  "suggested_status": "RESEARCH",
  "suggested_contexts": [
    "Protocols / Interoperability",
    "Runtime",
    "Capability / Effects",
    "Evolution Control"
  ],
  "lineage_family": "interoperability-learning-evolution",
  "lineage_order_hint": 1,
  "reported_sha256": "7748eb495d89670f16adf9691ee80312eccc5109c9ee87630688e53adf14ff29",
  "reported_size_bytes": 84365,
  "hash_status": "REPORTED_NOT_LOCALLY_VERIFIED",
  "discovered_at": "2026-08-11T15:55:00Z",
  "discovery_basis": "ChatGPT File Library discovery; exact raw bytes are not mounted in the active filesystem.",
  "notes": "Identity asserted by File Library manifest tare_tools_interoperability_learning_evolution_manifest_2026-08-10.json (file_00000000d418820e8b2a80d6f4492f57); manifest bytes not locally materialized."
}
