{
  "schema_version": "1.0",
  "reference_id": "libref.00000000df4c",
  "title": "tare_tools_governance_assurance_audit_scientific_research_2026-08-10.html",
  "file_library_id": "file_00000000df4c820e80676f9df313a47f",
  "file_created_at": "2026-08-10T09:22:21Z",
  "file_modified_at": "2026-08-10T09:22:21Z",
  "native_language": "pt-BR",
  "availability": "LIBRARY_REFERENCE_ONLY",
  "materialized_bytes": false,
  "translation_status": "BLOCKED_EXACT_SOURCE_NOT_MATERIALIZED",
  "priority": "P0",
  "suggested_kind": "research",
  "suggested_status": "RESEARCH",
  "suggested_contexts": [
    "Governance / Audit",
    "Validation / Assurance",
    "Evidence / Provenance"
  ],
  "lineage_family": "governance-assurance-audit",
  "lineage_order_hint": 1,
  "reported_sha256": "f3986251f7cf83bcd5b92a35a95820866e254865fc8ec38458b3aed8dfa44ff3",
  "reported_size_bytes": 82228,
  "hash_status": "REPORTED_NOT_LOCALLY_VERIFIED",
  "discovered_at": "2026-08-11T15:55:00Z",
  "discovery_basis": "ChatGPT File Library discovery; exact raw bytes are not mounted in the active filesystem.",
  "notes": "Identity asserted by File Library manifest tare_tools_governance_assurance_audit_manifest_2026-08-10.json (file_000000001678820e9d7e7971445b2856); manifest bytes not locally materialized."
}
