{
  "schema_version": "1.0",
  "reference_id": "libref.00000000d418",
  "title": "tare_tools_interoperability_learning_evolution_manifest_2026-08-10.json",
  "file_library_id": "file_00000000d418820e8b2a80d6f4492f57",
  "file_created_at": "2026-08-10T12:45:07Z",
  "file_modified_at": "2026-08-10T12:45:07Z",
  "native_language": "en",
  "availability": "LIBRARY_REFERENCE_ONLY",
  "materialized_bytes": false,
  "translation_status": "NOT_REQUIRED_NATIVE_ENGLISH",
  "priority": "P1",
  "suggested_kind": "validation-manifest",
  "suggested_status": "HISTORICAL",
  "suggested_contexts": [
    "Protocols / Interoperability",
    "Runtime",
    "Capability / Effects"
  ],
  "lineage_family": "interoperability-learning-evolution",
  "lineage_order_hint": 3,
  "reported_sha256": null,
  "reported_size_bytes": null,
  "hash_status": "UNKNOWN",
  "discovered_at": "2026-08-11T15:55:00Z",
  "discovery_basis": "ChatGPT File Library discovery; exact raw bytes are not mounted in the active filesystem.",
  "notes": ""
}
