{
  "schema_version": "1.0",
  "reference_id": "libref.000000001d10",
  "title": "harness_multiagent_research_program_v1.5_blocks1_to_15.md",
  "file_library_id": "file_000000001d10720e8344953fd860f8b0",
  "file_created_at": "2026-07-14T20:17:43Z",
  "file_modified_at": "2026-07-14T20:17:43Z",
  "native_language": "pt-BR",
  "availability": "LIBRARY_REFERENCE_ONLY",
  "materialized_bytes": false,
  "translation_status": "BLOCKED_EXACT_SOURCE_NOT_MATERIALIZED",
  "priority": "P1",
  "suggested_kind": "research-program",
  "suggested_status": "RESEARCH",
  "suggested_contexts": [
    "Harness / Agent OS Architecture",
    "Project / Workspace",
    "Workflow",
    "Routing & Adaptation",
    "Evolution Control",
    "Validation / Assurance"
  ],
  "lineage_family": "formal-research-program",
  "lineage_order_hint": "1.5-late",
  "reported_sha256": null,
  "reported_size_bytes": null,
  "hash_status": "UNKNOWN",
  "discovered_at": "2026-08-11T16:05:00Z",
  "discovery_basis": "ChatGPT File Library discovery; exact raw bytes are not mounted in the active filesystem.",
  "notes": "Same title/version label as an earlier File Library item but later timestamp and substantially expanded visible sections; preserve as distinct until exact content diff is possible."
}
