{
  "schema_version": "1.0",
  "reference_id": "libref.00000000c62c",
  "title": "PACKAGE_CLOSURE_REPORT.md",
  "file_library_id": "file_00000000c62c820e8600704eb8f6d92b",
  "file_created_at": "2026-08-08T03:58:59Z",
  "file_modified_at": "2026-08-08T03:58:59Z",
  "native_language": "pt-BR",
  "availability": "LIBRARY_REFERENCE_ONLY",
  "materialized_bytes": false,
  "translation_status": "BLOCKED_EXACT_SOURCE_NOT_MATERIALIZED",
  "priority": "P2",
  "suggested_kind": "evidence-report",
  "suggested_status": "HISTORICAL",
  "suggested_contexts": [
    "Validation / Assurance",
    "Evidence / Provenance",
    "Runtime"
  ],
  "lineage_family": "package-closure-report",
  "lineage_order_hint": "03:58",
  "reported_sha256": null,
  "reported_size_bytes": null,
  "hash_status": "UNKNOWN",
  "discovered_at": "2026-08-11T15:55:00Z",
  "discovery_basis": "ChatGPT File Library discovery; exact raw bytes are not mounted in the active filesystem.",
  "notes": ""
}
