{
  "schema_version": "1.0",
  "reference_id": "libref.000000003e8c",
  "title": "tare_tools_interoperability_learning_evolution_implementation_proposal_2026-08-10.html",
  "file_library_id": "file_000000003e8c820e8484e4857d25e050",
  "file_created_at": "2026-08-10T12:44:58Z",
  "file_modified_at": "2026-08-10T12:44:58Z",
  "native_language": "pt-BR",
  "availability": "LIBRARY_REFERENCE_ONLY",
  "materialized_bytes": false,
  "translation_status": "BLOCKED_EXACT_SOURCE_NOT_MATERIALIZED",
  "priority": "P0",
  "suggested_kind": "implementation-proposal",
  "suggested_status": "PROPOSED",
  "suggested_contexts": [
    "Protocols / Interoperability",
    "Runtime",
    "Capability / Effects",
    "Evolution Control"
  ],
  "lineage_family": "interoperability-learning-evolution",
  "lineage_order_hint": 2,
  "reported_sha256": "12aec05d4f26d7306500425e1f72e4a416ea6657a1680e982803f4d22f4de295",
  "reported_size_bytes": 67902,
  "hash_status": "REPORTED_NOT_LOCALLY_VERIFIED",
  "discovered_at": "2026-08-11T15:55:00Z",
  "discovery_basis": "ChatGPT File Library discovery; exact raw bytes are not mounted in the active filesystem.",
  "notes": "Identity asserted by File Library manifest tare_tools_interoperability_learning_evolution_manifest_2026-08-10.json (file_00000000d418820e8b2a80d6f4492f57); manifest bytes not locally materialized."
}
