{
  "schema_version": "1.0",
  "reference_id": "libref.000000004e40",
  "title": "artigo_harnesses_multiagenticos_ieee.pdf",
  "file_library_id": "file_000000004e4071f5a224607ab1d13ac3",
  "file_created_at": "2026-07-15T23:47:14Z",
  "file_modified_at": "2026-07-15T23:47:14Z",
  "native_language": "en",
  "availability": "LIBRARY_REFERENCE_ONLY",
  "materialized_bytes": false,
  "translation_status": "NOT_REQUIRED_NATIVE_ENGLISH",
  "priority": "P2",
  "suggested_kind": "scientific-paper-pdf",
  "suggested_status": "RESEARCH",
  "suggested_contexts": [
    "Harness / Agent OS Architecture",
    "Project / Workspace",
    "Identity / Authority / Policy"
  ],
  "lineage_family": "adaptive-harness-ieee",
  "lineage_order_hint": 4.1,
  "reported_sha256": null,
  "reported_size_bytes": null,
  "hash_status": "UNKNOWN",
  "discovered_at": "2026-08-11T15:55:00Z",
  "discovery_basis": "ChatGPT File Library discovery; exact raw bytes are not mounted in the active filesystem.",
  "notes": "Potential sibling/export near v4; preserve separately until exact lineage is proven."
}
