{
  "schema_version": "1.0",
  "reference_id": "libref.000000009cec",
  "title": "artigo_cientifico_harnesses_multiagenticos_adaptativos.md",
  "file_library_id": "file_000000009cec71f7b80ecdf858ce5023",
  "file_created_at": "2026-07-15T12:58:30Z",
  "file_modified_at": "2026-07-15T12:58:30Z",
  "native_language": "en",
  "availability": "LIBRARY_REFERENCE_ONLY",
  "materialized_bytes": false,
  "translation_status": "NOT_REQUIRED_NATIVE_ENGLISH",
  "priority": "P1",
  "suggested_kind": "scientific-manuscript",
  "suggested_status": "RESEARCH",
  "suggested_contexts": [
    "Harness / Agent OS Architecture",
    "Project / Workspace",
    "Identity / Authority / Policy",
    "Workflow",
    "Routing & Adaptation"
  ],
  "lineage_family": "adaptive-harness-scientific-article",
  "lineage_order_hint": 1.0,
  "reported_sha256": null,
  "reported_size_bytes": null,
  "hash_status": "UNKNOWN",
  "discovered_at": "2026-08-11T15:55:00Z",
  "discovery_basis": "ChatGPT File Library discovery; exact raw bytes are not mounted in the active filesystem.",
  "notes": ""
}
