{
  "schema_version": "1.0",
  "reference_id": "flref.identity.909f62618f93",
  "title": "tare_tools_identity_lineage_learning_research_SHA256SUMS_2026-08-12.txt",
  "file_library_id": "file_0000000054bc820ea188888a7256c3c8",
  "file_created_at": "2026-08-12",
  "file_modified_at": "2026-08-12",
  "native_language": "en",
  "availability": "LIBRARY_REFERENCE_ONLY",
  "materialized_bytes": false,
  "translation_status": "NOT_REQUIRED_NATIVE_ENGLISH",
  "priority": "P0",
  "suggested_kind": "checksums",
  "suggested_status": "RESEARCH",
  "suggested_contexts": [
    "Workflow",
    "Reliability",
    "Governance / Audit",
    "Evidence / Provenance",
    "Memory / Context",
    "Evolution Control",
    "Protocols / Interoperability"
  ],
  "lineage_family": "identity-lineage-learning-2026-08-12",
  "lineage_order_hint": null,
  "reported_sha256": null,
  "reported_size_bytes": null,
  "hash_status": "UNKNOWN",
  "discovered_at": "2026-08-12",
  "discovery_basis": "Shared-chat ingestion via File Library; public share URL was not fetchable from this runtime.",
  "notes": "Expected hash/size are reported by the research-pack validation manifest/checksum file. Raw bytes are not mounted locally, so no source_path or exact-byte materialization is asserted."
}
