{
  "schema_version": "1.0",
  "reference_id": "libref.000000002564",
  "title": "Markdown.md colado",
  "file_library_id": "file_000000002564820e8005d7937c5d20f5",
  "file_created_at": "2026-08-09T14:12:03Z",
  "file_modified_at": "2026-08-09T14:12:03Z",
  "native_language": "pt-BR",
  "availability": "LIBRARY_REFERENCE_ONLY",
  "materialized_bytes": false,
  "translation_status": "BLOCKED_EXACT_SOURCE_NOT_MATERIALIZED",
  "priority": "P2",
  "suggested_kind": "handoff",
  "suggested_status": "HISTORICAL",
  "suggested_contexts": [
    "Sandbox / Isolation",
    "Validation / Assurance",
    "Evidence / Provenance"
  ],
  "lineage_family": "validation-sandbox-mxc-handoffs",
  "lineage_order_hint": 2,
  "reported_sha256": null,
  "reported_size_bytes": null,
  "hash_status": "UNKNOWN",
  "discovered_at": "2026-08-11T15:55:00Z",
  "discovery_basis": "ChatGPT File Library discovery; exact raw bytes are not mounted in the active filesystem.",
  "notes": "Generic title in File Library; preserve identity and inspect full content before assigning a stronger canonical document title."
}
