{
  "schema_version": "1.0",
  "reference_id": "libref.000000000f9c",
  "title": "harness_multiagent_research_program_v1.6_blocks1_to_16.md",
  "file_library_id": "file_000000000f9c720e92740cb4f031cb42",
  "file_created_at": "2026-07-14T17:39:37Z",
  "file_modified_at": "2026-07-14T17:39:37Z",
  "native_language": "pt-BR",
  "availability": "LIBRARY_REFERENCE_ONLY",
  "materialized_bytes": false,
  "translation_status": "BLOCKED_EXACT_SOURCE_NOT_MATERIALIZED",
  "priority": "P1",
  "suggested_kind": "research-program",
  "suggested_status": "RESEARCH",
  "suggested_contexts": [
    "Harness / Agent OS Architecture",
    "Project / Workspace",
    "Identity / Authority / Policy",
    "Workflow",
    "Routing & Adaptation"
  ],
  "lineage_family": "formal-research-program",
  "lineage_order_hint": 1.6,
  "reported_sha256": null,
  "reported_size_bytes": null,
  "hash_status": "UNKNOWN",
  "discovered_at": "2026-08-11T15:55:00Z",
  "discovery_basis": "ChatGPT File Library discovery; exact raw bytes are not mounted in the active filesystem.",
  "notes": ""
}
