{
  "schema_version": "1.0",
  "reference_id": "libref.00000000eec8",
  "title": "harness_multiagent_research_program_v0.2_blocks1_2.md",
  "file_library_id": "file_00000000eec871f5ad5ecaea626e4c28",
  "file_created_at": "2026-07-14T13:20:47Z",
  "file_modified_at": "2026-07-14T13:20:47Z",
  "native_language": "pt-BR",
  "availability": "LIBRARY_REFERENCE_ONLY",
  "materialized_bytes": false,
  "translation_status": "BLOCKED_EXACT_SOURCE_NOT_MATERIALIZED",
  "priority": "P2",
  "suggested_kind": "research-program",
  "suggested_status": "RESEARCH",
  "suggested_contexts": [
    "Harness / Agent OS Architecture",
    "Project / Workspace",
    "Workflow",
    "Routing & Adaptation"
  ],
  "lineage_family": "formal-research-program",
  "lineage_order_hint": 0.2,
  "reported_sha256": null,
  "reported_size_bytes": null,
  "hash_status": "UNKNOWN",
  "discovered_at": "2026-08-11T16:05:00Z",
  "discovery_basis": "ChatGPT File Library discovery; exact raw bytes are not mounted in the active filesystem.",
  "notes": ""
}
