{
  "schema_version": "1.0",
  "reference_id": "libref.00000000354c",
  "title": "tare_tools_chat_archaeology_runtime_tui_repl_agent_os_2026-08-09.html",
  "file_library_id": "file_00000000354c820e9842b0702f01960a",
  "file_created_at": "2026-08-09T22:57:09Z",
  "file_modified_at": "2026-08-09T22:57:09Z",
  "native_language": "pt-BR",
  "availability": "LIBRARY_REFERENCE_ONLY",
  "materialized_bytes": false,
  "translation_status": "BLOCKED_EXACT_SOURCE_NOT_MATERIALIZED",
  "priority": "P1",
  "suggested_kind": "archaeology",
  "suggested_status": "HISTORICAL",
  "suggested_contexts": [
    "Experience / Human Interface",
    "Runtime",
    "Protocols / Interoperability",
    "Harness / Agent OS Architecture"
  ],
  "lineage_family": "runtime-tui-archaeology",
  "lineage_order_hint": 1,
  "reported_sha256": null,
  "reported_size_bytes": null,
  "hash_status": "UNKNOWN",
  "discovered_at": "2026-08-11T15:55:00Z",
  "discovery_basis": "ChatGPT File Library discovery; exact raw bytes are not mounted in the active filesystem.",
  "notes": ""
}
