{
  "schema_version": "1.0",
  "reference_id": "libref.0000000087d8",
  "title": "HANDOFF-chat-tare-tools-mxc-fsv-validation-2026-08-10.md",
  "file_library_id": "file_0000000087d8820e86204769aa65d8c0",
  "file_created_at": "2026-08-10T16:55:44Z",
  "file_modified_at": "2026-08-10T16:55:44Z",
  "native_language": "pt-BR",
  "availability": "LIBRARY_REFERENCE_ONLY",
  "materialized_bytes": false,
  "translation_status": "BLOCKED_EXACT_SOURCE_NOT_MATERIALIZED",
  "priority": "P1",
  "suggested_kind": "handoff",
  "suggested_status": "HISTORICAL",
  "suggested_contexts": [
    "Sandbox / Isolation",
    "Validation / Assurance",
    "Evidence / Provenance"
  ],
  "lineage_family": "validation-sandbox-mxc-handoffs",
  "lineage_order_hint": 3,
  "reported_sha256": null,
  "reported_size_bytes": null,
  "hash_status": "UNKNOWN",
  "discovered_at": "2026-08-11T15:55:00Z",
  "discovery_basis": "ChatGPT File Library discovery; exact raw bytes are not mounted in the active filesystem.",
  "notes": ""
}
