{
  "schema_version": "1.0",
  "reference_id": "flref.identity.90957948887b",
  "title": "tare_tools_identity_lineage_learning_research_manifest_2026-08-12.json",
  "file_library_id": "file_00000000a274820eaab028fdccb33cb2",
  "file_created_at": "2026-08-12",
  "file_modified_at": "2026-08-12",
  "native_language": "en",
  "availability": "LIBRARY_REFERENCE_ONLY",
  "materialized_bytes": false,
  "translation_status": "NOT_REQUIRED_NATIVE_ENGLISH",
  "priority": "P0",
  "suggested_kind": "validation-manifest",
  "suggested_status": "RESEARCH",
  "suggested_contexts": [
    "Workflow",
    "Reliability",
    "Governance / Audit",
    "Evidence / Provenance",
    "Memory / Context",
    "Evolution Control",
    "Protocols / Interoperability"
  ],
  "lineage_family": "identity-lineage-learning-2026-08-12",
  "lineage_order_hint": null,
  "reported_sha256": "5c233cfe709bfeb0b03ce617cd883a160abaf0b26901015ec28d32e639fd6fa8",
  "reported_size_bytes": null,
  "hash_status": "REPORTED_NOT_LOCALLY_VERIFIED",
  "discovered_at": "2026-08-12",
  "discovery_basis": "Shared-chat ingestion via File Library; public share URL was not fetchable from this runtime.",
  "notes": "Expected hash/size are reported by the research-pack validation manifest/checksum file. Raw bytes are not mounted locally, so no source_path or exact-byte materialization is asserted."
}
