{
  "schema_version": "1.0",
  "reference_id": "libref.00000000e01c",
  "title": "harness_to_agent_operating_system_scientific_research_2026-08-08.html",
  "file_library_id": "file_00000000e01c820e814ba1c1ffcc4d6f",
  "file_created_at": "2026-08-08T18:47:19Z",
  "file_modified_at": "2026-08-08T18:47:19Z",
  "native_language": "pt-BR",
  "availability": "LIBRARY_REFERENCE_ONLY",
  "materialized_bytes": false,
  "translation_status": "BLOCKED_EXACT_SOURCE_NOT_MATERIALIZED",
  "priority": "P0",
  "suggested_kind": "research",
  "suggested_status": "RESEARCH",
  "suggested_contexts": [
    "Harness / Agent OS Architecture",
    "Project / Workspace",
    "Identity / Authority / Policy"
  ],
  "lineage_family": "agent-os-north-star-research",
  "lineage_order_hint": "2026-08-08",
  "reported_sha256": null,
  "reported_size_bytes": null,
  "hash_status": "UNKNOWN",
  "discovered_at": "2026-08-11T15:55:00Z",
  "discovery_basis": "ChatGPT File Library discovery; exact raw bytes are not mounted in the active filesystem.",
  "notes": ""
}
