{
  "schema_version": "1.0",
  "reference_id": "flref.identity.a3154ff49b95",
  "title": "tare_tools_identity_lineage_research_index_2026-08-12.html",
  "file_library_id": "file_000000001eb8820ea1d9bbcd24cbd389",
  "file_created_at": "2026-08-12",
  "file_modified_at": "2026-08-12",
  "native_language": "en",
  "availability": "LIBRARY_REFERENCE_ONLY",
  "materialized_bytes": false,
  "translation_status": "NOT_REQUIRED_NATIVE_ENGLISH",
  "priority": "P0",
  "suggested_kind": "research-index",
  "suggested_status": "RESEARCH",
  "suggested_contexts": [
    "Workflow",
    "Reliability",
    "Governance / Audit",
    "Evidence / Provenance",
    "Memory / Context",
    "Evolution Control",
    "Protocols / Interoperability"
  ],
  "lineage_family": "identity-lineage-learning-2026-08-12",
  "lineage_order_hint": null,
  "reported_sha256": "67e5436917757d249884ddca9b90d2a520bf9afe810abeaf731735471a95c6fd",
  "reported_size_bytes": 10749,
  "hash_status": "REPORTED_NOT_LOCALLY_VERIFIED",
  "discovered_at": "2026-08-12",
  "discovery_basis": "Shared-chat ingestion via File Library; public share URL was not fetchable from this runtime.",
  "notes": "Expected hash/size are reported by the research-pack validation manifest/checksum file. Raw bytes are not mounted locally, so no source_path or exact-byte materialization is asserted."
}
